{
  "kind": "json-api",
  "request": {
    "url": "https://v1.hitokoto.cn/?c=i",
    "method": "GET",
    "headers": { "Accept": "application/json" }
  },
  "extract": { "title": "$.from", "content": "$.hitokoto" },
  "transform": ["trim"],
  "permissions": { "network": ["v1.hitokoto.cn"] },
  "rights": { "min_api_level": 1 }
}
